Keyword,Product 1,Product 2,Product 3,Product 4,Product 5,Product 6
Headset,"SENS CNATRA 1 Bluetooth Headset with Intelligent Insta Connect (IIC), ENC, Voice Assistant  and up to 22hrs Playback (Mirage White, True Wireless)","SENS Hendriks 2 Bluetooth Headset with Active Noise Cancellation(ANC),  Environmental Noise Cancellation(ENC), MEMS MIC, Auto Pairing & up to 30 hrs Playback  (Pearl White, True Wireless)","Boult Audio ZCharge 40H Playtime & Super Fast Charging, Environmental Noise Cancellation for Pro+ Calling & IPX5 Water Resistant Bluetooth Wireless in Ear Earphones with Mic (Blue)","JBL Tune 215BT, 16 Hrs Playtime with Quick Charge, in Ear Bluetooth Wireless Earphones with Mic, 12.5mm Premium Earbuds with Pure Bass, BT 5.0, Dual Pairing, Type C & Voice Assistant Support (Black)","Newly Launched Boult Audio Z25 with 32H Playtime, 45ms Low Latency, Type-C Fast Charging (10=150Mins), 13mm Rich Bass Drivers, Zen™ ENC Mic, TWS Bluetooth 5.3 True Wireless Airbass Earbuds (Blue Moss)","Boult Audio Maverick Bluetooth Truly Wireless in Ear Earbuds with 35H Playtime, Quad Mic ENC, 45ms Xtreme Low Latency, Gaming LEDs, 10mm Bass Drivers, Type-C Fast Charging Bluetooth 5.3 TWS Ear Buds"
Headset wire,"Boult Audio ProBass Thunder Over-Ear Wireless Bluetooth Headphones with Mic, Headset with Long Battery Life",ELECTMART YS Original Handsfree Wired Headset Compatible with Samsung Galaxy A31 and All Samsung Galaxy 3.5mm Jack Smartphones,"Boult Audio Newly Launched YCharge with 12H Playtime, Lightning Type-C Fast Charging, Pro+ Calling HD Mic, 10mm Rich Bass Drivers, IPX5, Bluetooth Wireless Earphones Neckband Probass (Blue)","pTron Pride Lite HBE (High Bass Earphones) in Ear Wired Earphones with Mic, 10mm Powerful Driver for Stereo Audio, Noise Cancelling Headset with 1.2m Tangle-Free Cable & 3.5mm Aux - (Blue)",Aroma NB140 Dhamaal 24 Hours* Playtime | Deep Bass | Made in India | TrueWireless Bluetooth Headset (Black),"Boult Audio ZCharge 40H Playtime & Super Fast Charging, Environmental Noise Cancellation for Pro+ Calling & IPX5 Water Resistant Bluetooth Wireless in Ear Earphones with Mic (Blue)"
Headset with mic,"Boult Audio Maverick Bluetooth Truly Wireless in Ear Earbuds with 35H Playtime, Quad Mic ENC, 45ms Xtreme Low Latency, Gaming LEDs, 10mm Bass Drivers, Type-C Fast Charging Bluetooth 5.3 TWS Ear Buds","SENS Hendriks 2 Bluetooth Headset with Active Noise Cancellation(ANC),  Environmental Noise Cancellation(ENC), MEMS MIC, Auto Pairing & up to 30 hrs Playback  (Pearl Black, True Wireless)","Boult Audio ZCharge 40H Playtime & Super Fast Charging, Environmental Noise Cancellation for Pro+ Calling & IPX5 Water Resistant Bluetooth Wireless in Ear Earphones with Mic (Blue)","iClever Bluetooth Wireless Over Ear Headphones with Mic, Foldable Wireless Headset, HiFi Sound,Deep Bass 45 Hours Playtime, Fast Charge Bluetooth 5.2 Headset for PC/iPad, Green",boAt BassHeads 100 in-Ear Wired Headphones with Mic (Black),"Newly Launched Boult Audio Z25 with 32H Playtime, 45ms Low Latency, Type-C Fast Charging (10=150Mins), 13mm Rich Bass Drivers, Zen™ ENC Mic, TWS Bluetooth 5.3 True Wireless Airbass Earbuds (Blue Moss)"
Headset wired,"pTron Pride Lite HBE (High Bass Earphones) in Ear Wired Earphones with Mic, 10mm Powerful Driver for Stereo Audio, Noise Cancelling Headset with 1.2m Tangle-Free Cable & 3.5mm Aux - (Blue)","PTron Boom Ultima 4D Dual Driver, in-Ear Gaming Wired Headphones with in-line Mic, Volume Control & Passive Noise Cancelling Boom 3 Earphones - (Dark Blue)",boAt BassHeads 100 in-Ear Wired Headphones with Mic (Black),"GOBASS 455 in Ear Wired Earphones with HD Mic for Calls, 10mm Dynamic Driver, Noise Cancellation (Blue)","Boult Audio Maverick Bluetooth Truly Wireless in Ear Earbuds with 35H Playtime, Quad Mic ENC, 45ms Xtreme Low Latency, Gaming LEDs, 10mm Bass Drivers, Type-C Fast Charging Bluetooth 5.3 TWS Ear Buds","GOVO GOBASS 455 in Ear Wired Earphones with HD Mic for Calls, 10mm Dynamic Driver, Noise Cancellation (Platinum Black)"
Headset wireless,"SHOKZ OpenMove Bluetooth Wireless Headphones with Mic, Bone Conduction Wireless Headset with 6H Playtime, IP55 Waterproof Sports Headphones for Running, Workout, Cycling (Slate Grey)","SENS CNATRA 1 Bluetooth Headset with Intelligent Insta Connect (IIC), ENC, Voice Assistant  and up to 22hrs Playback  (Midnight Green, True Wireless)","Amazon Basics in-Ear Bluetooth 5.0 Neckband with Up to 30 Hours Playtime, with Mic, Magnetic Earbuds, Voice Assistant, Dual Pairing and IPX6 Rated, Blue","JBL Tune 760NC, Wireless Over Ear Active Noise Cancellation Headphones with Mic, up to 50 Hours Playtime, Pure Bass, Dual Pairing, AUX & Voice Assistant Support for Mobile Phones (Black)","JBL Tune 215BT, 16 Hrs Playtime with Quick Charge, in Ear Bluetooth Wireless Earphones with Mic, 12.5mm Premium Earbuds with Pure Bass, BT 5.0, Dual Pairing, Type C & Voice Assistant Support (Black)","boAt Rockerz 550 Bluetooth Wireless Over Ear Headphones with Mic Upto 20 Hours Playback, 50MM Drivers, Soft Padded Ear Cushions and Physical Noise Isolation (Red)"
Headset bluetooth,"SENS CNATRA 1 Bluetooth Headset with Intelligent Insta Connect (IIC), ENC, Voice Assistant  and up to 22hrs Playback (Mirage White, True Wireless)","SENS MJ 1 Bluetooth Headset with ENC, SVVC Mode (Low Latency), AFAP(As Fast As Possible) Within 45 mins to Full Charge & up to 24 hrs Playback (Gun Metal Grey)","truke Buds BTG 1 Bluetooth Truly Wireless Gaming in Ear Earbuds with (ENC) & Quad MEMS Mic for Clear Calls, 13mm Titanium Driver, 48H Playtime, Fast Charging, True Gaming Mode, AAC Codec, IPX4","Boult Audio Z20 Truly Wireless in Ear Earbuds with Zen™ ENC mic, 40H Battery Life, Type-C Fast Charging, Made in India, 10mm Bass Drivers, Environmental Noise Cancellation, Bluetooth Ear Buds (Green)","Boult Audio ZCharge 40H Playtime & Super Fast Charging, Environmental Noise Cancellation for Pro+ Calling & IPX5 Water Resistant Bluetooth Wireless in Ear Earphones with Mic (Blue)","Newly Launched Boult Audio Z25 with 32H Playtime, 45ms Low Latency, Type-C Fast Charging (10=150Mins), 13mm Rich Bass Drivers, Zen™ ENC Mic, TWS Bluetooth 5.3 True Wireless Airbass Earbuds (Blue Moss)"
Headset wired with mic,Jabra Jabra Evolve 20 Wired On Ear hEadphones with microphone black,"GOVO GOBASS 455 in Ear Wired Earphones with HD Mic for Calls, 10mm Dynamic Driver, Noise Cancellation (Platinum Black)","boAt Rockerz 255 Pro+ in-Ear Bluetooth Neckband with Upto 40 Hours Playback, ASAP Charge, IPX7, Dual Pairing, BT v5.0, with Mic (Active Black)","Boult Audio ZCharge 40H Playtime & Super Fast Charging, Environmental Noise Cancellation for Pro+ Calling & IPX5 Water Resistant Bluetooth Wireless in Ear Earphones with Mic (Blue)",Aroma NB140 Dhamaal 24 Hours* Playtime | Deep Bass | Made in India | TrueWireless Bluetooth Headset (Black),"pTron Pride Lite HBE (High Bass Earphones) in Ear Wired Earphones with Mic, 10mm Powerful Driver for Stereo Audio, Noise Cancelling Headset with 1.2m Tangle-Free Cable & 3.5mm Aux - (Blue)"
Headset wireless with mic,"SHOKZ OpenMove Bluetooth Wireless Headphones with Mic, Bone Conduction Wireless Headset with 6H Playtime, IP55 Waterproof Sports Headphones for Running, Workout, Cycling (Slate Grey)","boAt Rockerz 255 Pro+ in-Ear Bluetooth Neckband with Upto 40 Hours Playback, ASAP Charge, IPX7, Dual Pairing, BT v5.0, with Mic (Active Black)","pTron Tangent Evo, 14Hrs Playback, Bluetooth 5.0 Earphones, In-Ear Headphones with Mic, Deep Bass, Clear Calls, IPX4 Water Resistant Neckband, Voice Assistance, Magnetic Earbuds & Fast Charging (Blue)","Boult Audio ZCharge 40H Playtime & Super Fast Charging, Environmental Noise Cancellation for Pro+ Calling & IPX5 Water Resistant Bluetooth Wireless in Ear Earphones with Mic (Blue)","SENS Hendriks 2 Bluetooth Headset with Active Noise Cancellation(ANC),  Environmental Noise Cancellation(ENC), MEMS MIC, Auto Pairing & up to 30 hrs Playback  (Pearl Black, True Wireless)","Boult Audio Z20 Truly Wireless in Ear Earbuds with Zen™ ENC mic, 40H Battery Life, Type-C Fast Charging, Made in India, 10mm Bass Drivers, Environmental Noise Cancellation, Bluetooth Ear Buds (Green)"
Headset for mobile,boAt Bassheads 220 in Ear Earphones(Black Indi),"Boult Audio ZCharge 40H Playtime & Super Fast Charging, Environmental Noise Cancellation for Pro+ Calling & IPX5 Water Resistant Bluetooth Wireless in Ear Earphones with Mic (Blue)",Aroma NB140 Dhamaal 24 Hours* Playtime | Deep Bass | Made in India | TrueWireless Bluetooth Headset (Black),"Amazon Basics in-Ear Bluetooth 5.0 Neckband with Up to 30 Hours Playtime, with Mic, Magnetic Earbuds, Voice Assistant, Dual Pairing and IPX6 Rated, Blue","boAt Rockerz 450 Bluetooth On Ear Headphones with Mic, Upto 15 Hours Playback, 40MM Drivers, Padded Ear Cushions, Integrated Controls and Dual Modes(Luscious Black)","pTron Pride Lite HBE (High Bass Earphones) in Ear Wired Earphones with Mic, 10mm Powerful Driver for Stereo Audio, Noise Cancelling Headset with 1.2m Tangle-Free Cable & 3.5mm Aux - (Blue)"
Headset for laptop,"Jabra Evolve2 75 PC Wireless Headset with 8-Microphone Technology - Dual Foam Stereo Headphones with Adjustable Advanced Active Noise Cancelling, USB-A Bluetooth Adapter and UC Compatibility - Black","Honeywell Moxie V10 Bluetooth V5.0 Wireless On Ear Headphone with mic, Upto 12H Playtime, 40mm Drivers, Padded Ear Cushions, Integrated Controls, Deep Bass, IPX4, 3.5mm AUX, Voice Assistant Enabled",Logitech H111 Wired On Ear Headphones With Mic Black,Royal Mobile SH-12 Wireless Bluetooth Headphone with FM/SD Card Slot with Music and Calling Control_ Earphones_8548,Dealfreez Mijia Headphones Hi-Res Audio Relaxed Version (White),TECHCLUES X 20 PRO Bluetooth Headset -02
